stop_id,Current Cleaning Category,abc_stop_name
1499,C,Slater Rd at Page Rd (Coastal Credit Union)
6274,C,NC 54 at S Alston Ave (EB)
6610,C,Stadium Dr at Horton Rd
6160,C,Dowd St at Hazel St (EB)
5749,C,E Weaver St at Pilot St
6290,C,E Geer St at Landon Farms Ln (EB)
5129,C,NC 54 at The Hamptons Apts (WB)
5353,C,Holloway St at Miami Blvd (EB)
5045,C,Roxboro Rd at Edgewood Dr
5023,C,Avondale Dr at E Markham Ave (SB)
6086,C,E Main St at Hyde Park Ave (EB)
6266,C,Miami Blvd at New Haven Dr
6536,C,Ben Franklin Blvd at Medical Park Dr (V
6681,C,SW Durham Dr at Durham-Chapel Hill Blvd
5524,C,Mangum St at Trinity Ave
5446,C,Guess Rd at Ellen St
5928,C,James St at Nation Ave
6130,C,Lawson St at Bacon St (EB)
5424,C,S Roxboro St at Bond St
5993,C,Duke St at Trinity Ave
5846,C,Chapel Hill Rd at Vineyard St
6289,C,E Geer St at Midland Terrace (EB)
6049,C,Service Rd at Hillandale Rd (WB)
6351,C,Ross Rd at Idlewood Rd
5910,C,Angier Ave at Ellis Rd
5441,C,NC 54 at Waterford Valley Dr (WB)
6334,C,Chapel Dr at Duke University Rd (Alumni
6485,C,Hardee St at Mimosa St (SB)
5259,C,N Alston Ave at Geer St (NB)
5904,C,Chapel Hill Rd at Anderson St
6097,C,NC 55 at Corona St
4209720,C,CHALK LEVEL RD AT CONVERGENC
6397,C,Alston Ave at Riddle Rd (NB)
5595,C,Duke St at Markham Ave
5930,C,Broad St at Sprunt Ave (SB)
6206,C,Guess Rd at Crystal Lake Rd
6621,C,Garrett Rd at Glenbrook West Apartments
5522,C,Dearborn Dr at Cannada Ave (Disciples C
5706,C,Roxboro St at Masondale Ave
6677,C,Angier Ave at East End Ave (EB)
6128,C,Stadium Dr at Wyldewood Rd (Foxfire Apt
6678,C,Angier Ave at Midway Ave (EB)
6159,C,Dowd St at Gurley St (EB)
6630,C,TW Alexander Dr at ACC Blvd (WakeMed Em
5153,C,Garrett Rd at Old Chapel Hill Rd
6245,C,Geer St at Glendale Ave
6281,C,TW Alexander Dr at Stirrup Creek Dr
5781,C,W Enterprise St at Fargo St
5136,C,Fayetteville Rd at Pearson Dr
5094,C,Lakewood Ave at Blackwell St
6244,C,W Geer St at Glendale Ave
5201,C,Angier Ave at Wrenn Rd (SB)
5231,C,University Dr at Beech Lake Apts
5482,C,Roxboro Rd at Lynch St
5351,C,LaSalle St at Bradford Ridge Apts
6470,C,Lawson St at BRITE Science Complex
6171,C,Lawson St at NCCU Track (EB)
5858,C,Chapel Hill Rd at Wa Wa Ave
5306,C,Morehead Ave at Arnette Ave (WB)
5057,C,Angier Ave at Driver St (EB)
5934,C,Duke St at Jackson St
5836,C,Dearborn Dr at Maplewood Dr (south)
789987,C,HILLANDALE RD AT CARVER ST
5516,C,Duke St at Carver St
5197,C,Morehead Ave at Arnette Ave (EB)
5221,C,E Weaver St at Jesmond St
6020,C,Otis St at Pilot St
5466,C,ROXBORO RD AT ARGONNE DR
5204,C,S Alston Ave at Dupree St (SB)
5664,C,Dearborn Dr at Thelma St (NB)
789984,C,HILLANDALE RD AT CLUB BLVD
6574,C,Liberty St at Elizabeth St (WB)
5720,C,Junction Rd at NC 98
6395,C,Briggs Ave at Person St (SB 1)
5257,C,Shirley St at Ratcale Ln
1221,C,Slater Rd at Page Rd (Imperial Point)
5365,C,Raynor St at Hardee St (EB)
6007,C,Service Rd at Hillandale Rd (EB)
1804,C,Renaissance Pkwy at Leonardo Dr (WB)
5027,C,Club Blvd at Gregson St
1865,C,NC 54 at Triangle Dr (WB)
6165,C,Old Chapel Hill Rd at Garrett Rd (WB)
5203,C,Avondale Dr at E Markham Ave (NB)
5567,C,Fayetteville Rd at Juliette Dr (SB)
6004,C,NC 55 at Crete St
6688,C,Little Brier Creek Ln at TW Alexander D
5239,C,Cornwallis Rd at Spring Ridge Apt
5389,C,Constitution Dr at McKinley St
5464,C,Morehead Ave at Vickers Ave (EB)
1557,C,NC 54 at New Millennium Way (WB)
5906,C,Garrett Rd at Eno River Church
6611,C,Ben Franklin Blvd at Medical Park Dr (W
6472,C,Herndon Rd at Fayetteville Rd
5970,C,Fayetteville Rd at Cook Rd (SB)
5271,C,Dearborn Dr at Deer Run (NB)
5047,C,Roxboro Rd at Markham Ave (south)
5229,C,Roxboro Rd at Hugo St
5240,C,Freeman Rd at Valmet Dr
5574,C,Durham-Chapel Hill Blvd at Hope Valley
789988,C,HILLANDALE RD AT CROASDAILE
6320,C,Martin Luther King Jr Pkwy at Stratford
5430,C,Riddle Rd at Kirby St (SB)
5035,C,Angier Ave at Pleasant Dr
5272,C,Duke University Rd at Anderson St (EB)
6644,C,Garrett Rd at Yates Baptist Association
6545,C,Morreene Rd at Campus Walk Ave (NB)
5356,C,Holloway St at Miami Blvd (WB)
6546,C,American Dr at Hillgrand Dr (WB)
5946,C,Cornwallis Rd at Chapel Hill Rd (Rogers
5439,C,Gregson St at Lamond Ave
5307,C,Shannon Rd at University Dr (Wells Farg
5472,C,Old Oxford Rd at Dearborn Dr (EB)
6201,C,Hillandale Rd at Hillandale Elementary
6331,C,Erwin Rd at Trent Dr (WB)
5988,C,Roxboro St at Gray St
5618,C,Holloway St at Joyland Ave (EB)
1074,C,University Dr at American Red Cross
1777,C,Slater Rd at Sheraton Hotel
5695,C,Hillandale Rd at Fawn Ave (Croasdaile O
6676,C,Guess Rd at Victory Blvd
6205,C,Guess Rd at Peppertree St
6619,C,Cornwallis Rd at Chapel Hill Rd (WB)
5055,C,Gregson St at Englewood Ave
5333,C,Angier Ave at Jones Cir (NB)
5540,C,Chapel Hill Rd at Pickett Rd (SB)
5116,C,Roxboro St at Duke St (Autozone)
5492,C,Dearborn Dr at Cannada Ave (NB)
6520,C,Miami Blvd at Ellis Rd (SB)
6156,C,Carver St at Meriwether Dr
6286,C,Chapel Dr at Duke University Rd (Duke N
6155,C,Roxboro Rd at Crutchfield St Duke Regional
6173,C,Holloway St at Southerland St (EB)
5509,C,Old Farm Rd at Seven Oaks Rd
5674,C,University Dr at Springfield Apts
5423,C,Enterprise St at Roxboro St (EB)
5868,C,Club Blvd at Cascadilla St
5346,C,Raynor St at Fidelity Dr (EB)
6478,C,NC 98 at Little Wonders
6175,C,E Main St at Roberson St (EB)
5235,C,University Dr at University Pl (WB)
5601,C,Cornwallis Rd at Industry Ln
789992,C,HILLANDALE RD AT CLUB BLVD
6394,C,Capps St at Athens St (EB)
5776,C,NC 54 at Paradigm Park
6488,C,Raynor St at Hardee St (WB)
5242,C,Riddle Rd at Kirby St (NB)
5984,C,NC 55 at Dakota St (NB)
6276,C,S Alston Ave at Duke Health (SB)
5350,C,Gary St at Liberty St (NB)
789995,C,BEN FRANKLIN BLVD AT PACIFIC
5612,C,Chapel Hill St at Gregson St (EB)
5581,C,E Club Blvd at Lindbergh St
5276,C,Broad St at Forest Rd (NB)
5347,C,E Club Blvd at Dominion St
5939,C,Otis St at Nelson St
6133,C,Briggs Ave at Riddle Rd (SB)
5727,C,Broad St at Sprunt Ave (NB)
1556,C,NC 54 at New Millennium Way (EB)
5434,C,Milton Rd at Long Cresent Dr
5615,C,Gary St at Liberty St (SB)
5775,C,Duke University Rd at Swift Ave (EB)
5018,C,Morehead Ave at Vickers Ave (WB)
5496,C,Dearborn Dr at Maplewood Dr (north)
5920,C,Hardee St at Mimosa St (NB)
5471,C,Erwin Rd at Lenox Baker Childrens Hosp
5658,C,Durham Chapel Hill Blvd at James St
5982,C,Duke University Rd at Swift Ave (WB)
6313,C,Angier Ave at Bungalow Ave
5779,C,Capps St at Athens St (WB)
789990,C,HILLANDALE RD AT PINETREE CT
5322,C,Meriwether Dr at E Carver St (NB)
6340,C,NC 55 at Carpenter Fletcher Rd (SB)
6600,C,Roxboro Rd at Dillard St
5048,C,Chapel Hill Rd at Pinecrest Rd
5675,C,Otis St at Alton St
6463,C,Milton Rd at Durham County Library
5220,C,Duke St at Demerius St
5662,C,Roxboro Rd at Lavender Ave
5005,C,Cornwallis Rd at Industry Ln
5320,C,Gregson St at W Knox St
6606,C,Guess Rd at Horton Rd (Cross Creek Shop
6254,C,Highgate Dr at Harrier Ct
5547,C,Sima Ave at Bacon St
6680,C,Great Jones St at Main St (Museum of Du
5702,C,Roxboro Rd at Knox St (NB)
5081,C,Trent Dr at Duke Circle Parking Deck
5317,C,Duke University Rd at Anderson St (WB)
6178,C,E Main St at Cherry Grove St (WB)
6287,C,S Alston Ave at Englert Dr (SB)
5324,C,Roxboro St at Dunstan Ave
5470,C,Raynor St at Fidelity Dr (WB)
5450,C,Meriwether Dr at Oxford Ct
5241,C,Lawson St at DTCC F Lot (EB)
6026,C,Cornwallis Rd at Beechwood Ave
5843,C,Concord St at Otis St
6693,C,W Enterprise St at E Forest Hills Blvd
5038,C,Liberty St at Queen St
1864,C,NC 54 at Research Triangle High School
6212,C,Hillandale Rd at Croasdaile Farms
6533,C,Mangum St at Ramseur St
5602,C,E Main St at Goley St (WB)
6261,C,Miami Blvd at Stirrup Creek Dr (PBM Gra
6098,C,Riddle Rd at Ancroft Ave (SB)
5339,C,Angier Ave at Jones Cir (SB)
5892,C,Sima Ave at Building 18
5929,C,Briggs Ave at Community Gardens
5372,C,NC 54 at Boulder Rd (WB)
5512,C,Alston Ave at Cecil St (NCCU)
6058,C,Lawson St at S Briggs Ave (Ferguson)
1732,C,Stirrup Creek at Twin Creek Ct
6132,C,Briggs Ave at Person St (SB 2)
6643,C,Garrett Rd at Carillon Assisted Living
789991,C,CHALK LEVEL RD AT SHAFTSBURY
5089,C,Duke St at Englewood Ave
5942,C,Roxboro St at Mallard Ave
5922,C,E Main St at Blacknall St (EB)
1776,C,Slater Rd at GoTriangle Admin Office
1222,C,Slater Rd at Emperor Blvd (Chelsea Place)
5622,C,GLENBROOK DR AT CLUB BLVD
1863,C,NC 54 at Park Office Dr (The Frontier)
5657,C,Chapel Hill St at Kent St (WB)
5678,C,Morehead Ave at Cornell St (EB)
6601,C,New Castle Rd at Stadium Dr (WB)
5290,C,Bacon St at Durham Public Schools Wareh
5400,C,Roxboro Rd at Channing Ave (NB)
5735,C,Holloway St at S Woodcrest St
6064,C,Roxboro Rd at Omega Rd
6069,C,Chapel Hill St at Carroll St
1861,C,NC 54 at Park Dr (First Citizens Bank)
5006,C,Alston Ave at Durham Freeway (NB)
5832,C,Dearborn Dr at Apollo St (SB)
6615,C,Milton Rd at Post Office
1563,C,Slater Rd at Emperor Blvd (Bright Horiz
1860,C,NC 54 at Park Dr (EB)
5032,C,Roxboro Rd at Hammond St
5101,C,E Club Blvd at Thorne St
5248,C,Guess Rd at Duke Homestead Rd (SB)
5264,C,Bacon St at Lawson St
5277,C,Dearborn Dr at Apollo St (NB)
5371,C,NC 54 at Boulder Rd (EB)
5528,C,Martin Luther King Jr Pkwy at Fayettevi
5704,C,Guess Rd at Duke Homestead Rd (NB)
5849,C,Dearborn Dr at Thelma St (SB)
6193,C,Fayetteville St MLK Jr. Pkwy (SB)
6441,C,Duke University Rd at Chapel Dr (EB)
6498,C,Milton Rd at Long Cresent Dr
6532,C,TW Alexander Dr at Roche Dr (Implus)
